{"$schema":"https://json-schema.org/draft/2020-12/schema","$id":"https://alpitt.github.io/-knaus-companion/data/system_graph.schema.json","title":"Knaus Companion system graph","type":"object","required":["schemaVersion","graphId","title","nodes","edges","groups","categories","relationshipTypes","metadata"],"properties":{"schemaVersion":{"const":1},"graphId":{"type":"string","pattern":"^graph:"},"title":{"type":"string"},"nodes":{"type":"array","items":{"$ref":"#/$defs/node"}},"edges":{"type":"array","items":{"$ref":"#/$defs/edge"}},"groups":{"type":"array"},"categories":{"type":"array","items":{"type":"string"}},"relationshipTypes":{"type":"array","items":{"type":"string"}},"metadata":{"type":"object","required":["readOnly","source"]}},"$defs":{"node":{"type":"object","required":["id","type","name","confidence","provenance"],"properties":{"id":{"type":"string"},"type":{"enum":["system","subsystem","component","connector","fuse","pipe","hose","cable","relay","switch","valve","sensor","equipment","accessory","document","evidence","owner-record","measurement","fault","maintenance","modification","unknown"]},"name":{"type":"string"},"description":{"type":"string"},"systemId":{"type":"string"},"confidence":{"enum":["confirmed","high","medium","low","unknown"]},"provenance":{"type":"string"},"digitalTwinRef":{"type":"string"},"evidenceRefs":{"type":"array","items":{"type":"string"}},"manualPageRefs":{"type":"array","items":{"type":"integer","minimum":1,"maximum":286}},"chapterRefs":{"type":"array","items":{"type":"integer","minimum":1,"maximum":44}},"kbRefs":{"type":"array","items":{"type":"string"}},"route":{"type":"string"}}},"edge":{"type":"object","required":["id","sourceId","targetId","type","direction","confidence","provenance"],"properties":{"id":{"type":"string"},"sourceId":{"type":"string"},"targetId":{"type":"string"},"type":{"enum":["contains","member-of","connected-to","installed-in","related-to","supplies","protected-by","controls","senses","flows-to","returns-to","unknown"]},"direction":{"enum":["directed","undirected"]},"confidence":{"enum":["confirmed","high","medium","low","unknown"]},"provenance":{"type":"string"},"evidenceRefs":{"type":"array","items":{"type":"string"}},"unknown":{"type":"boolean"}}}}}
