{"schemaVersion":1,"graphId":"graph:knaus-sun-traveller","title":"Knaus Sun Traveller documented systems graph","nodes":[
{"id":"system:vehicle","type":"system","name":"Base vehicle","confidence":"high","provenance":"digital-twin","digitalTwinRef":"system:vehicle","route":"#vehicle"},{"id":"system:habitation","type":"system","name":"Habitation body","confidence":"medium","provenance":"digital-twin","digitalTwinRef":"system:habitation","route":"#vehicle"},{"id":"system:electrical","type":"system","name":"Electrical","confidence":"high","provenance":"digital-twin","digitalTwinRef":"system:electrical","route":"#electrical"},{"id":"system:water","type":"system","name":"Water","confidence":"unknown","provenance":"digital-twin","digitalTwinRef":"system:water","route":"#water"},{"id":"system:gas","type":"system","name":"Gas","confidence":"unknown","provenance":"digital-twin","digitalTwinRef":"system:gas","route":"#gas"},{"id":"system:heating","type":"system","name":"Heating","confidence":"unknown","provenance":"digital-twin","digitalTwinRef":"system:heating","route":"#heating"},{"id":"system:refrigeration","type":"system","name":"Refrigeration","confidence":"unknown","provenance":"digital-twin","digitalTwinRef":"system:refrigeration","route":"#refrigeration"},{"id":"system:communications","type":"system","name":"Communications and entertainment","confidence":"medium","provenance":"digital-twin","digitalTwinRef":"system:communications","route":"#vehicle"},{"id":"system:safety","type":"system","name":"Safety equipment","confidence":"unknown","provenance":"digital-twin","digitalTwinRef":"system:safety","route":"#emergency"},{"id":"system:accessories","type":"system","name":"Installed accessories","confidence":"medium","provenance":"digital-twin","digitalTwinRef":"system:accessories","route":"#vehicle"},
{"id":"component:calira-evs","type":"component","name":"Calira EVS 30/20-DS/IU","systemId":"system:electrical","confidence":"confirmed","provenance":"digital-twin","digitalTwinRef":"component:calira-evs","evidenceRefs":["evidence:vehicle-photograph"],"route":"#electrical"},{"id":"component:calira-vb06","type":"component","name":"Calira VB06-1","systemId":"system:electrical","confidence":"confirmed","provenance":"digital-twin","digitalTwinRef":"component:calira-vb06","evidenceRefs":["evidence:vehicle-photograph"],"route":"#fuses"},{"id":"component:calira-vb04","type":"component","name":"Calira VB04","systemId":"system:electrical","confidence":"high","provenance":"digital-twin","digitalTwinRef":"component:calira-vb04","route":"#fuses"},{"id":"component:anker-solix-c1000","type":"accessory","name":"Anker Solix C1000 Gen 2","systemId":"system:accessories","confidence":"high","provenance":"digital-twin","digitalTwinRef":"component:anker-solix-c1000","route":"#electrical"},{"id":"component:auto-vox-sl5","type":"accessory","name":"AUTO-VOX SL5","systemId":"system:accessories","confidence":"high","provenance":"digital-twin","digitalTwinRef":"component:auto-vox-sl5","route":"#vehicle"},{"id":"component:alden-satellite","type":"equipment","name":"Alden automatic satellite dish","systemId":"system:communications","confidence":"medium","provenance":"digital-twin","digitalTwinRef":"component:alden-satellite","route":"#vehicle"}],
"edges":[{"id":"edge:evs-vb06","sourceId":"component:calira-evs","targetId":"component:calira-vb06","type":"connected-to","direction":"directed","confidence":"medium","provenance":"relationship:evs-vb06","evidenceRefs":["evidence:electrical-reference"]},{"id":"edge:vb04-vehicle","sourceId":"component:calira-vb04","targetId":"system:vehicle","type":"installed-in","direction":"directed","confidence":"high","provenance":"relationship:vb04-vehicle"},{"id":"edge:camera-vehicle","sourceId":"component:auto-vox-sl5","targetId":"system:vehicle","type":"installed-in","direction":"directed","confidence":"high","provenance":"relationship:camera-vehicle"},{"id":"edge:anker-accessories","sourceId":"component:anker-solix-c1000","targetId":"system:accessories","type":"related-to","direction":"directed","confidence":"high","provenance":"relationship:anker-accessories"},{"id":"edge:alden-communications","sourceId":"component:alden-satellite","targetId":"system:communications","type":"installed-in","direction":"directed","confidence":"medium","provenance":"relationship:alden-communications"},{"id":"edge:evs-system","sourceId":"component:calira-evs","targetId":"system:electrical","type":"member-of","direction":"directed","confidence":"confirmed","provenance":"digital-twin systemId"},{"id":"edge:vb06-system","sourceId":"component:calira-vb06","targetId":"system:electrical","type":"member-of","direction":"directed","confidence":"confirmed","provenance":"digital-twin systemId"},{"id":"edge:vb04-system","sourceId":"component:calira-vb04","targetId":"system:electrical","type":"member-of","direction":"directed","confidence":"high","provenance":"digital-twin systemId"},{"id":"edge:anker-system","sourceId":"component:anker-solix-c1000","targetId":"system:accessories","type":"member-of","direction":"directed","confidence":"high","provenance":"digital-twin systemId"},{"id":"edge:camera-system","sourceId":"component:auto-vox-sl5","targetId":"system:accessories","type":"member-of","direction":"directed","confidence":"high","provenance":"digital-twin systemId"},{"id":"edge:alden-system","sourceId":"component:alden-satellite","targetId":"system:communications","type":"member-of","direction":"directed","confidence":"medium","provenance":"digital-twin systemId"}],"groups":[],"categories":["vehicle","habitation","electrical","water","gas","heating","refrigeration","communications","safety","accessories"],"relationshipTypes":["member-of","connected-to","installed-in","related-to"],"metadata":{"readOnly":true,"source":"app/data/digital_twin.json","generatedAt":"2026-07-28T00:00:00Z","unknownRelationshipsRemainUnknown":true}}
